{"manifest_type":"figure_family","manifest_version":"1.0","id":"explainability.pdp_ice","version":"1.0","communication_tasks":["explainability"],"data_roles_required":["precomputed_effect"],"data_roles_optional":["group"],"sample_constraints":{"upstream_analysis_required":true},"supports_grouping":true,"supports_uncertainty":true,"supports_small_multiples":true,"supports_shared_color_scale":false,"recommended_layout_primitives":["paired","small_multiples"],"incompatible_encodings":["computed_inside_renderer"],"renderer_backend":"matlab","renderer_entrypoint":"src.matlab_sci_plot.families:render_synthetic","capabilities":["precomputed_effect"],"status":"extension"}
