{"manifest_type":"figure_family","manifest_version":"1.0","id":"explainability.base","version":"1.0","communication_tasks":["explainability"],"data_roles_required":["feature_importance"],"data_roles_optional":["group"],"sample_constraints":{"precomputed_values_only":true},"supports_grouping":false,"supports_uncertainty":false,"supports_small_multiples":false,"supports_shared_color_scale":false,"recommended_layout_primitives":["single"],"incompatible_encodings":["fabricated_explanations"],"renderer_backend":"matlab","matlab_renderer":"mpRenderExplainability","renderer_entrypoint":"src.matlab_sci_plot.families:render_synthetic","capabilities":["precomputed_importance"],"status":"extension"}
