{"manifest_type":"figure_family","manifest_version":"1.0","id":"explainability.shap_beeswarm","version":"1.0","communication_tasks":["explainability"],"data_roles_required":["precomputed_shap"],"data_roles_optional":["group"],"sample_constraints":{"upstream_analysis_required":true},"supports_grouping":true,"supports_uncertainty":false,"supports_small_multiples":false,"supports_shared_color_scale":true,"recommended_layout_primitives":["single"],"incompatible_encodings":["computed_inside_renderer"],"renderer_backend":"matlab","renderer_entrypoint":"src.matlab_sci_plot.families:render_synthetic","capabilities":["precomputed_shap"],"status":"extension"}
