{"manifest_type":"figure_family","manifest_version":"1.0","id":"optimization.response_surface","version":"1.0","communication_tasks":["optimization","response_surface"],"data_roles_required":["precomputed_surface"],"data_roles_optional":[],"sample_constraints":{"upstream_analysis_required":true},"supports_grouping":false,"supports_uncertainty":false,"supports_small_multiples":false,"supports_shared_color_scale":true,"recommended_layout_primitives":["single"],"incompatible_encodings":["fit_inside_renderer"],"renderer_backend":"matlab","renderer_entrypoint":"src.matlab_sci_plot.families:render_synthetic","capabilities":["precomputed_surface"],"status":"extension"}
