{"manifest_type":"figure_family","manifest_version":"1.0","id":"optimization.pareto","version":"1.0","communication_tasks":["optimization"],"data_roles_required":["precomputed_objectives"],"data_roles_optional":[],"sample_constraints":{"upstream_analysis_required":true},"supports_grouping":false,"supports_uncertainty":false,"supports_small_multiples":false,"supports_shared_color_scale":false,"recommended_layout_primitives":["single"],"incompatible_encodings":["new_optimization_inside_renderer"],"renderer_backend":"matlab","renderer_entrypoint":"src.matlab_sci_plot.families:render_synthetic","capabilities":["precomputed_pareto"],"status":"extension"}
