{"manifest_type":"figure_family","manifest_version":"1.0","id":"prediction.parity","version":"1.0","communication_tasks":["validation","prediction_comparison"],"data_roles_required":["truth","prediction"],"data_roles_optional":["group","uncertainty"],"sample_constraints":{"common_complete_sample":true},"supports_grouping":true,"supports_uncertainty":true,"supports_small_multiples":true,"supports_shared_color_scale":true,"recommended_layout_primitives":["single","hero_plus_diagnostics"],"incompatible_encodings":["generic_95_percent_band"],"renderer_backend":"matlab","renderer_entrypoint":"src.matlab_sci_plot.families:render_synthetic","capabilities":["native_scatter","shared_metrics"],"status":"active"}
