{"manifest_type":"figure_family","manifest_version":"1.0","id":"comparison.profile_radar","version":"1.0","communication_tasks":["multivariate_profile"],"data_roles_required":["numeric","category"],"data_roles_optional":["group"],"sample_constraints":{"multivariate_profile_required":true},"supports_grouping":true,"supports_uncertainty":false,"supports_small_multiples":false,"supports_shared_color_scale":false,"recommended_layout_primitives":["triptych"],"incompatible_encodings":["single_metric_model_ranking"],"renderer_backend":"matlab","renderer_entrypoint":"src.matlab_sci_plot.families:render_synthetic","capabilities":["polaraxes_fallback"],"status":"extension"}
