{"manifest_type":"figure_family","manifest_version":"1.0","id":"trend.line","version":"1.0","communication_tasks":["trend","process_trend"],"data_roles_required":["ordered","numeric"],"data_roles_optional":["group","uncertainty"],"sample_constraints":{},"supports_grouping":true,"supports_uncertainty":true,"supports_small_multiples":true,"supports_shared_color_scale":false,"recommended_layout_primitives":["single","small_multiples"],"incompatible_encodings":["unordered_x"],"renderer_backend":"matlab","matlab_renderer":"mpRenderTrendLine","renderer_entrypoint":"src.matlab_sci_plot.families:render_synthetic","capabilities":["native_line"],"status":"active"}
