{"manifest_type":"figure_family","manifest_version":"1.0","id":"comparison.metric_panels","version":"1.0","communication_tasks":["comparison","model_comparison"],"data_roles_required":["numeric","category"],"data_roles_optional":["group"],"sample_constraints":{"common_complete_sample":true},"supports_grouping":true,"supports_uncertainty":true,"supports_small_multiples":false,"supports_shared_color_scale":false,"recommended_layout_primitives":["paired","triptych"],"incompatible_encodings":["dual_axis_default"],"renderer_backend":"matlab","matlab_renderer":"mpRenderComparisonMetricPanels","renderer_entrypoint":"src.matlab_sci_plot.families:render_synthetic","capabilities":["native_bar","shared_metrics"],"status":"active"}
