{"manifest_type":"figure_family","manifest_version":"1.0","id":"matrix.heatmap","version":"1.0","communication_tasks":["matrix","correlation"],"data_roles_required":["matrix"],"data_roles_optional":[],"sample_constraints":{},"supports_grouping":false,"supports_uncertainty":false,"supports_small_multiples":false,"supports_shared_color_scale":true,"recommended_layout_primitives":["single"],"incompatible_encodings":[],"renderer_backend":"matlab","renderer_entrypoint":"src.matlab_sci_plot.families:render_synthetic","capabilities":["native_imagesc"],"status":"extension"}
