{"manifest_type":"figure_family","manifest_version":"1.0","id":"distribution.histogram_kde","version":"1.0","communication_tasks":["distribution","group_comparison"],"data_roles_required":["numeric"],"data_roles_optional":["group"],"sample_constraints":{},"supports_grouping":true,"supports_uncertainty":false,"supports_small_multiples":true,"supports_shared_color_scale":false,"recommended_layout_primitives":["paired","small_multiples"],"incompatible_encodings":["summary_only_for_small_samples"],"renderer_backend":"matlab","renderer_entrypoint":"src.matlab_sci_plot.families:render_synthetic","capabilities":["native_histogram","kde_optional"],"status":"active"}
