{"manifest_type":"figure_family","manifest_version":"1.0","id":"optimization.extension","version":"1.0","communication_tasks":["optimization","pareto","response_surface"],"data_roles_required":["numeric"],"data_roles_optional":["group"],"sample_constraints":{"upstream_analysis_required":true},"supports_grouping":true,"supports_uncertainty":false,"supports_small_multiples":false,"supports_shared_color_scale":false,"recommended_layout_primitives":["single"],"incompatible_encodings":["undeclared_inference"],"renderer_backend":"matlab","renderer_entrypoint":"src.matlab_sci_plot.families:render_synthetic","capabilities":["extension_placeholder"],"status":"extension"}
